{
  "schema_version": "1.0",
  "market": "CN_COMMODITY_FUTURES",
  "fixture_class": "SYNTHETIC_CONTRACT",
  "cases": [
    {
      "id": "futures-daily-settlement-v1",
      "kind": "settlement",
      "evidence_status": "SYNTHETIC_CONTRACT",
      "formal_eligible": false,
      "inputs": {
        "previous_quantity": 2,
        "previous_settlement": "100",
        "opened_quantity": 1,
        "opened_price": "102",
        "settlement_price": "105",
        "multiplier": "10",
        "fees": "5"
      },
      "expected": {"mark_to_market": "125", "ending_quantity": 3}
    },
    {
      "id": "futures-broker-margin-uplift-v1",
      "kind": "margin",
      "evidence_status": "SYNTHETIC_CONTRACT",
      "formal_eligible": false,
      "inputs": {
        "exchange_rate": "0.10",
        "broker_rate": "0.12",
        "settlement_price": "500",
        "multiplier": "10",
        "quantity": 3
      },
      "expected": {"required_margin": "1800.00"}
    },
    {
      "id": "futures-close-today-fee-v1",
      "kind": "fee",
      "evidence_status": "SYNTHETIC_CONTRACT",
      "formal_eligible": false,
      "inputs": {
        "offset": "CLOSE_TODAY",
        "close_today_per_lot": "10",
        "close_yesterday_per_lot": "2",
        "quantity": 3,
        "price": "500",
        "multiplier": "10"
      },
      "expected": {"fee": "30"}
    },
    {
      "id": "futures-close-yesterday-lot-v1",
      "kind": "close_offset",
      "evidence_status": "SYNTHETIC_CONTRACT",
      "formal_eligible": false,
      "inputs": {
        "today_quantity": 3,
        "yesterday_quantity": 2,
        "quantity": 2,
        "offset": "CLOSE_YESTERDAY"
      },
      "expected": {"today_quantity": 3, "yesterday_quantity": 0}
    },
    {
      "id": "futures-delivery-force-exit-v1",
      "kind": "delivery_exit",
      "evidence_status": "SYNTHETIC_CONTRACT",
      "formal_eligible": false,
      "inputs": {"force_exit_date": "2026-08-20", "as_of": "2026-08-20"},
      "expected": {"may_open": false, "must_exit": true}
    },
    {
      "id": "futures-main-by-oi-confirmation-v1",
      "kind": "main_contract",
      "evidence_status": "SYNTHETIC_CONTRACT",
      "formal_eligible": false,
      "inputs": {
        "current_contract": "RB2610",
        "decision_date": "2026-08-09",
        "confirmation_days": 3,
        "threshold": "1.2",
        "observations": [
          {"trade_date": "2026-08-07", "contract": "RB2610", "delivery_month": 202610, "open_interest": "100"},
          {"trade_date": "2026-08-07", "contract": "RB2701", "delivery_month": 202701, "open_interest": "125"},
          {"trade_date": "2026-08-08", "contract": "RB2610", "delivery_month": 202610, "open_interest": "100"},
          {"trade_date": "2026-08-08", "contract": "RB2701", "delivery_month": 202701, "open_interest": "125"},
          {"trade_date": "2026-08-09", "contract": "RB2610", "delivery_month": 202610, "open_interest": "100"},
          {"trade_date": "2026-08-09", "contract": "RB2701", "delivery_month": 202701, "open_interest": "125"},
          {"trade_date": "2026-08-10", "contract": "RB2610", "delivery_month": 202610, "open_interest": "100"},
          {"trade_date": "2026-08-10", "contract": "RB2701", "delivery_month": 202701, "open_interest": "10"}
        ]
      },
      "expected": {"contract": "RB2701"}
    },
    {
      "id": "futures-night-session-trade-date-v1",
      "kind": "night_trade_date",
      "evidence_status": "SYNTHETIC_CONTRACT",
      "formal_eligible": false,
      "inputs": {
        "product": "AU",
        "night_start": "21:00",
        "night_end": "02:30",
        "settlement_at": "15:15",
        "night_calendar_date": "2026-08-10",
        "exchange_trade_date": "2026-08-11",
        "timestamp": "2026-08-11T02:29:00"
      },
      "expected": {"trade_date": "2026-08-11"}
    },
    {
      "id": "futures-round-trip-fee-v1",
      "kind": "transaction_cost",
      "evidence_status": "SYNTHETIC_CONTRACT",
      "formal_eligible": false,
      "inputs": {
        "price": "500",
        "quantity": 1,
        "multiplier": "10",
        "fee_rate": "0.0002",
        "slippage_bps": "0.0"
      },
      "expected": {
        "single_side_fee": "1.00",
        "round_trip_fee": "2.00"
      }
    }
  ]
}
